train,stations
train_1,"[Delft, Den Haag Centraal, Gouda, Alphen a/d Rijn, Leiden Centraal, Schiphol Airport, Amsterdam Zuid, Amsterdam Sloterdijk, Haarlem]"
train_2,"[Gouda, Rotterdam Alexander, Rotterdam Centraal, Dordrecht, Rotterdam Centraal, Schiedam Centrum, Delft, Den Haag Centraal, Leiden Centraal, Heemstede-Aerdenhout, Haarlem]"
train_3,"[Amsterdam Sloterdijk, Amsterdam Centraal, Amsterdam Amstel, Amsterdam Zuid, Amsterdam Sloterdijk, Zaandam, Hoorn, Alkmaar]"
train_4,"[Zaandam, Beverwijk, Haarlem, Beverwijk, Castricum, Zaandam, Hoorn]"
train_5,"[Castricum, Alkmaar, Den Helder]"
score,9031.0
