train,stations
train_1,"[Den Haag Centraal, Gouda, Alphen a/d Rijn, Leiden Centraal, Schiphol Airport, Amsterdam Zuid, Amsterdam Sloterdijk, Haarlem, Beverwijk]"
train_2,"[Gouda, Rotterdam Alexander, Rotterdam Centraal, Dordrecht, Rotterdam Centraal, Schiedam Centrum, Delft, Den Haag Centraal, Leiden Centraal, Heemstede-Aerdenhout, Haarlem]"
train_3,"[Amsterdam Zuid, Amsterdam Amstel, Amsterdam Centraal, Amsterdam Sloterdijk, Zaandam, Hoorn, Alkmaar, Den Helder]"
train_4,"[Castricum, Beverwijk, Zaandam, Castricum, Alkmaar]"
score,9202.0
