train,stations
train_1,"[Delft, Schiedam Centrum, Rotterdam Centraal, Rotterdam Alexander, Gouda, Den Haag Centraal, Leiden Centraal, Heemstede-Aerdenhout, Haarlem, Amsterdam Sloterdijk, Amsterdam Centraal, Amsterdam Amstel, Amsterdam Zuid, Schiphol Airport]"
train_2,"[Castricum, Alkmaar, Hoorn, Zaandam, Amsterdam Sloterdijk, Amsterdam Zuid, Schiphol Airport, Leiden Centraal, Alphen a/d Rijn]"
train_3,"[Den Helder, Alkmaar, Castricum, Zaandam, Beverwijk, Castricum, Alkmaar, Castricum]"
train_4,"[Alphen a/d Rijn, Gouda, Rotterdam Alexander, Rotterdam Centraal, Dordrecht, Rotterdam Centraal, Schiedam Centrum, Rotterdam Centraal, Schiedam Centrum, Rotterdam Centraal, Schiedam Centrum, Rotterdam Centraal, Schiedam Centrum, Rotterdam Centraal, Schiedam Centrum]"
train_5,"[Delft, Den Haag Centraal, Leiden Centraal, Den Haag Centraal, Leiden Centraal, Den Haag Centraal, Leiden Centraal, Den Haag Centraal, Leiden Centraal, Den Haag Centraal]"
train_6,"[Haarlem, Beverwijk]"
score,8810.0
