train,stations
train_1,"[Haarlem, Beverwijk, Zaandam, Castricum, Beverwijk, Haarlem, Heemstede-Aerdenhout, Leiden Centraal, Schiphol Airport]"
train_2,"[Den Haag Centraal, Leiden Centraal, Alphen a/d Rijn, Gouda, Den Haag Centraal, Delft, Schiedam Centrum, Rotterdam Centraal, Rotterdam Alexander, Gouda]"
train_3,"[Zaandam, Hoorn, Alkmaar, Den Helder]"
train_4,"[Amsterdam Zuid, Schiphol Airport, Leiden Centraal, Heemstede-Aerdenhout, Haarlem, Amsterdam Sloterdijk, Amsterdam Centraal, Amsterdam Amstel, Amsterdam Zuid, Amsterdam Sloterdijk, Zaandam, Castricum, Alkmaar]"
train_5,"[Dordrecht, Rotterdam Centraal]"
score,9057.0
