train,stations
train_1,"[Dordrecht, Rotterdam Centraal, Schiedam Centrum, Delft, Den Haag Centraal, Gouda, Alphen a/d Rijn, Leiden Centraal, Den Haag Centraal]"
train_2,"[Beverwijk, Zaandam, Hoorn, Alkmaar, Den Helder]"
train_3,"[Heemstede-Aerdenhout, Haarlem, Amsterdam Sloterdijk, Amsterdam Centraal, Amsterdam Amstel, Amsterdam Zuid, Schiphol Airport, Leiden Centraal, Heemstede-Aerdenhout, Haarlem, Beverwijk, Castricum, Alkmaar]"
train_4,"[Rotterdam Alexander, Rotterdam Centraal, Schiedam Centrum, Delft, Den Haag Centraal, Gouda, Rotterdam Alexander, Gouda, Alphen a/d Rijn, Leiden Centraal]"
train_5,"[Amsterdam Sloterdijk, Zaandam, Castricum, Beverwijk, Castricum, Beverwijk, Haarlem, Amsterdam Sloterdijk, Amsterdam Zuid]"
score,8961.0
