train,stations
train_1,"[Amsterdam Centraal, Amsterdam Sloterdijk, Zaandam, Castricum, Alkmaar, Hoorn, Zaandam, Beverwijk]"
train_2,"[Haarlem, Beverwijk, Castricum, Beverwijk, Zaandam, Amsterdam Sloterdijk, Amsterdam Zuid, Amsterdam Amstel, Amsterdam Centraal, Amsterdam Sloterdijk]"
train_3,"[Leiden Centraal, Alphen a/d Rijn, Gouda, Den Haag Centraal, Delft, Schiedam Centrum, Rotterdam Centraal, Dordrecht, Rotterdam Centraal, Rotterdam Alexander]"
train_4,"[Heemstede-Aerdenhout, Haarlem, Amsterdam Sloterdijk, Zaandam, Hoorn, Alkmaar, Den Helder]"
train_5,"[Gouda, Rotterdam Alexander, Gouda, Alphen a/d Rijn, Gouda, Den Haag Centraal, Leiden Centraal, Heemstede-Aerdenhout, Haarlem]"
train_6,"[Amsterdam Zuid, Schiphol Airport, Leiden Centraal]"
score,8824.0
